{
  "$schema": "https://json-schema.org/draft/2020-12/schema",
  "title": "ERC-1155 Item Metadata",
  "type": "object",
  "required": ["id", "name", "description", "image", "attributes"],
  "properties": {
    "id": {
      "description": "Token ID as unsigned integer.",
      "type": "integer",
      "minimum": 0
    },
    "name": { "type": "string", "minLength": 1 },
    "description": { "type": "string" },
    "image": { "type": "string", "minLength": 1 },
    "attributes": {
      "type": "array",
      "items": {
        "type": "object",
        "required": ["trait_type", "value"],
        "properties": {
          "trait_type": { "type": "string", "minLength": 1 },
          "value": {}
        },
        "additionalProperties": true
      }
    }
  },
  "additionalProperties": true
}
